id,title,source_org,raw_text_status
1358,AI s Impact on SEO 13 Things That Changed 4 Things That Stayed The Same,Ahrefs,done
1458,AI s Impact on SEO 13 Things That Changed 4 Things That Stayed The Same,Ahrefs,done
1452,AI s Impact on SEO 13 Things That Changed 4 Things That Stayed The Same 2,Ahrefs,done
1352,AI s Impact on SEO 13 Things That Changed 4 Things That Stayed The Same 2,Ahrefs,done
1353,AI s Impact on SEO 13 Things That Changed 4 Things That Stayed The Same 3,Ahrefs,done
1453,AI s Impact on SEO 13 Things That Changed 4 Things That Stayed The Same 3,Ahrefs,done
1354,AI s Impact on SEO 13 Things That Changed 4 Things That Stayed The Same 4,Ahrefs,done
1454,AI s Impact on SEO 13 Things That Changed 4 Things That Stayed The Same 4,Ahrefs,done
1355,AI s Impact on SEO 13 Things That Changed 4 Things That Stayed The Same 5,Ahrefs,done
1455,AI s Impact on SEO 13 Things That Changed 4 Things That Stayed The Same 5,Ahrefs,done
1356,AI s Impact on SEO 13 Things That Changed 4 Things That Stayed The Same 6,Ahrefs,done
1456,AI s Impact on SEO 13 Things That Changed 4 Things That Stayed The Same 6,Ahrefs,done
1357,AI s Impact on SEO 13 Things That Changed 4 Things That Stayed The Same 7,Ahrefs,done
1457,AI s Impact on SEO 13 Things That Changed 4 Things That Stayed The Same 7,Ahrefs,done
1406,GEO LLMO AEO It s All Just SEO,Ahrefs,done
1506,GEO LLMO AEO It s All Just SEO,Ahrefs,done
1503,GEO LLMO AEO It s All Just SEO 2,Ahrefs,done
1403,GEO LLMO AEO It s All Just SEO 2,Ahrefs,done
1504,GEO LLMO AEO It s All Just SEO 3,Ahrefs,done
1404,GEO LLMO AEO It s All Just SEO 3,Ahrefs,done
1505,GEO LLMO AEO It s All Just SEO 4,Ahrefs,done
1405,GEO LLMO AEO It s All Just SEO 4,Ahrefs,done
1402,Generative Engine Optimization Growth Strategies and Metrics For the AI Era,Ahrefs,done
1502,Generative Engine Optimization Growth Strategies and Metrics For the AI Era,Ahrefs,done
523,How to Rank in AI Overviews What Actually Works Based on Data Not Speculation None Part 1,Ahrefs,done
524,How to Rank in AI Overviews What Actually Works Based on Data Not Speculation None Part 2,Ahrefs,done
525,How to Rank in AI Overviews What Actually Works Based on Data Not Speculation None Part 3,Ahrefs,done
526,How to Rank in AI Overviews What Actually Works Based on Data Not Speculation None Part 4,Ahrefs,done
529,How to Rank in AI Overviews What Actually Works Based on Data Not Speculation Partner with YouTube c,Ahrefs,done
528,How to Rank in AI Overviews What Actually Works Based on Data Not Speculation Partner with YouTube c 2,Ahrefs,done
532,Insights From 55 8M AI Overviews Across 590M Searches,Ahrefs,done
531,Insights From 55 8M AI Overviews Across 590M Searches 2,Ahrefs,done
527,Insights From 55 8M AI Overviews Across 590M Searches 3,Ahrefs,done
530,Insights From 55 8M AI Overviews Across 590M Searches 4,Ahrefs,done
1553,Is AI Content Bad for SEO No and It Never Will Be 7 Reasons,Ahrefs,done
1551,Is AI Content Bad for SEO No and It Never Will Be 7 Reasons 2,Ahrefs,done
1552,Is AI Content Bad for SEO No and It Never Will Be 7 Reasons 3,Ahrefs,done
539,Update 38 of AI Overview Citations Pull From The Top 10,Ahrefs,done
537,Update 38 of AI Overview Citations Pull From The Top 10 2,Ahrefs,done
538,Update 38 of AI Overview Citations Pull From The Top 10 3,Ahrefs,done
540,Update AI Overviews Reduce Clicks by 58,Ahrefs,done
262,Bing IndexNow Real Time Indexing for AI Visibility,Bing,done
260,Bing Webmaster Guidelines AI and Copilot Grounding,Bing,done
97,AB Testing and Multivariate Testing Best Practices for Google Search,Google,done
337,AI Features and Your Website Controlling your content in AI features in Search,Google,done
338,AI Features and Your Website How AI features work in Search,Google,done
339,AI Features and Your Website How to appear in AI features,Google,done
99,AI Features and Your Website – AI Overviews and AI Mode,Google,done
100,"AMP on Google Search – Guidelines, How It Works, Enhancing, Validating, and Removing",Google,done
98,Ad Networks and Translation Related Google Search Features,Google,done
102,"Article Structured Data – News, Blog, and Sports Articles",Google,done
105,"Article Structured Data – News, Blog, and Sports Articles",Google,error
101,Ask Google to Recrawl Your URLs,Google,done
103,Ask Google to Recrawl Your URLs,Google,error
104,Block Search Indexing with noindex,Google,done
106,Book Actions Structured Data – Enabling Buy and Borrow Actions,Google,done
108,Build and Submit a Sitemap to Google,Google,done
109,Business Details in Google Search and Maps,Google,done
110,Byline Dates – Adding Publication Dates to Search Results,Google,done
111,Carousel Structured Data – Host Carousels with ItemList,Google,done
112,Changing Your Web Hosting Without Changing URLs,Google,done
114,Combining Sitemap Extensions – Using Multiple Extensions in One File,Google,done
115,Controlling What Content Google Can Find and Index,Google,done
117,"Core Web Vitals – LCP, INP, and CLS Explained",Google,done
118,Course List Structured Data – Course Discoverability on Google,Google,done
119,Crawling and Indexing – Overview,Google,done
120,Creating Helpful People First Content,Google,done
121,Debug Google Search Traffic Drops,Google,done
128,Debug Google Search Traffic Drops,Google,done
129,Debugging with Google Search Operators,Google,done
123,Debugging with Google Search Operators,Google,done
132,Developer's Guide to Search,Google,done
124,Developer's Guide to Search,Google,done
126,Do You Need an SEO,Google,done
133,Do You Need an SEO,Google,done
127,Dynamic Rendering as a Workaround for JavaScript Content,Google,done
134,Dynamic Rendering as a Workaround for JavaScript Content,Google,done
137,Ecommerce SEO – Overview and Guide Structure,Google,done
135,Ecommerce Site Structure – Helping Google Understand Navigation Hierarchy,Google,done
136,Ecommerce URL Structure Design Best Practices,Google,done
138,Education Q&A Structured Data – Flashcard Pages,Google,done
140,Enriched Search Results – Interactive Rich Results with Structured Data,Google,done
141,Event Structured Data – Event Rich Results on Google,Google,done
142,FAQ Structured Data – FAQPage for Government and Health Sites,Google,done
143,Fact Check Structured Data – ClaimReview for Fact Checking Articles,Google,done
144,Favicons in Google Search – Guidelines and Requirements,Google,done
146,File Types Indexable by Google,Google,done
147,Fix Canonicalization Issues,Google,done
149,Fix Lazy Loaded Content for Google Search,Google,done
148,Fix Search Related JavaScript Problems,Google,done
150,Flexible Sampling – Paywalls and Limited Content Access,Google,done
153,Generate Structured Data with JavaScript,Google,done
152,Get Started with Google Search Console,Google,done
151,Get Started with Google Trends for SEO,Google,done
155,Get Your Website on Google,Google,done
263,Google AI Mode How It Works and Optimisation,Google,done
264,Google AI Overviews Content Optimisation for Citation,Google,done
265,Google AI Overviews Eligibility and Technical Requirements,Google,done
266,Google AI Overviews Generative AI Content Policy,Google,done
267,Google AI Overviews Robots Meta Tag Controls,Google,done
156,Google Discover – How Content Is Selected and Best Practices,Google,done
154,Google Safe Browsing Repeat Offenders Policy,Google,done
158,Google Search Reviews System,Google,done
157,Googlebot – What It Is and How It Works,Google,done
159,Guidance on Generative AI Content,Google,done
160,Guidelines for Sites with Explicit Content,Google,done
165,"HTTP Status Codes, Network Errors, and DNS Errors",Google,done
161,How Google Crawls Locale Adaptive Pages,Google,done
163,How Google Search Works,Google,done
162,How Structured Data Works – Introduction to Rich Results,Google,done
164,How to Launch an Ecommerce Website on Google,Google,done
166,Image License Metadata – Licensable Badge in Google Images,Google,done
167,Image Removals – Removing Images from Google Search Results,Google,done
168,Image SEO Best Practices for Google Search,Google,done
169,Image Sitemaps – Helping Google Find Site Images,Google,done
170,Improve SEO with a Search Console Bubble Chart in Looker Studio,Google,done
171,International and Multilingual Sites – Overview,Google,done
172,Interstitials and Dialogs – Avoiding Intrusive Page Overlays,Google,done
174,Introduction to robots.txt,Google,done
173,Introduction – Google Search Central Documentation,Google,done
178,Keep Redacted Information Out of Google Search,Google,done
181,Local Business Structured Data – LocalBusiness for Knowledge Panels and Maps,Google,done
184,Maintaining Your Website's SEO,Google,done
183,Malware and Unwanted Software – What They Are and Google's Guidelines,Google,done
185,Managing Crawling of Faceted Navigation URLs,Google,done
186,Managing Multi Regional and Multilingual Sites,Google,done
187,Math Solver Structured Data – MathSolver for Educational Tools,Google,done
188,Merchant Listing Structured Data – Products for Sale,Google,done
193,Meta Tags and HTML Attributes that Google Supports,Google,done
191,Mobile First Indexing Best Practices,Google,done
192,Move a Site with URL Changes – Migrations and Domain Changes,Google,done
194,Movie Carousel Structured Data – Movie Rich Results on Mobile,Google,done
195,News Sitemaps – Submitting News Articles to Google,Google,done
196,Organisation Structured Data – Helping Google Understand Your Business Entity,Google,done
197,Package Tracking – Early Adopters Program for Delivery Companies,Google,done
198,Page Removals – How to Remove a Page from Google Search,Google,done
199,Pagination and Incremental Page Loading for Ecommerce,Google,done
200,Preferred Sources – Helping Your Audience Follow Your Publication,Google,done
202,Prevent User Generated Spam on Your Site,Google,done
201,Prevent a Malware Infection – Security Best Practices for Site Owners,Google,done
203,Preventing and Monitoring Abuse on Your Site – Overview,Google,done
204,Product Snippet Structured Data – Non Merchant Product Pages,Google,done
205,Product Variants Structured Data – ProductGroup for Size and Color Variants,Google,done
209,Ranking and Search Appearance – Overview,Google,done
207,Recipe Structured Data – Rich Results for Recipes,Google,done
212,Review Snippet Structured Data – Stars and Ratings in Search Results,Google,done
214,"Robots Meta Tag, data nosnippet, and X Robots Tag Specifications",Google,done
217,SEO Starter Guide,Google,done
271,Schema FAQPage AEO Deep Dive,Google,done
272,Schema HowTo AEO Application,Google,done
274,Schema Speakable Voice and AEO Optimisation,Google,done
213,Search Essentials – Overview,Google,done
215,Search Essentials – Technical Requirements,Google,done
218,Share Product Data with Google – Structured Data and Merchant Center,Google,done
216,Signed Exchanges – Prefetching for Better Page Experience,Google,done
219,Site Names in Google Search,Google,done
220,Sitelinks – How Google Generates Navigation Links for Sites,Google,done
221,Sitemap Index Files – Managing Multiple Sitemaps,Google,done
222,Sitemaps – What They Are and When to Use One,Google,done
223,Snippets and Meta Descriptions,Google,done
225,Social Engineering – Phishing and Deceptive Sites,Google,done
224,Software App Structured Data – SoftwareApplication Rich Results,Google,done
226,Spam Policies – Cloaking Through Link Spam,Google,done
227,Spam Policies – Machine Generated Content Through Scam and Fraud,Google,done
229,Speakable Structured Data – Audio Playback for News Content,Google,done
230,Structured Data Carousels Beta – New Host Carousel Format,Google,done
231,"Structured Data Deployment Workflow – How to Build, Test, and Release",Google,done
233,Structured Data General Guidelines,Google,done
232,Structured Data for Ecommerce Sites – Relevant Schema Types,Google,done
234,Subscription and Paywalled Content Structured Data,Google,done
236,Tell Google About Localized Versions of Your Pages – hreflang Annotations,Google,done
235,Temporarily Pause or Disable a Website,Google,done
237,Title Links in Google Search – How They Are Generated and Best Practices,Google,done
238,Top Places List – Site Eligibility for Business Mentions,Google,done
240,Translated Results – Cross Language Search Results,Google,done
239,Troubleshoot Google Search Crawling Errors,Google,done
243,URL Structure Best Practices for Google Search,Google,done
241,Understanding Google Search Ranking Systems,Google,done
242,Understanding Page Experience in Google Search,Google,done
245,Using Search Console and Google Analytics Together for SEO,Google,done
247,Video SEO Best Practices for Google Search,Google,done
251,Video SEO Best Practices for Google Search,Google,done
250,Video Sitemaps and Alternatives,Google,done
248,Video Sitemaps and Alternatives,Google,done
253,Visual Elements Gallery – Google Search Result Building Blocks,Google,done
255,"Web Stories – Enable, Best Practices, and Content Policy",Google,done
256,What is URL Canonicalization,Google,done
257,What to Do If Your Site Is Incorrectly Flagged as Explicit,Google,done
259,Write High Quality Reviews for Ecommerce,Google,done
261,Bing Copilot Content Structure for AI Grounding,Microsoft,done
113,Canonical URLs – How to Specify and Consolidate Duplicate Pages,Moz,done
145,Featured Snippets – How They Work and How to Opt Out,Moz,done
175,JavaScript SEO Basics – How Google Crawls and Renders JavaScript,Moz,done
177,JavaScript SEO Basics – How Google Crawls and Renders JavaScript,Moz,done
179,Large Site Owner's Guide to Managing Your Crawl Budget,Moz,done
180,Link Best Practices – Crawlability and Anchor Text,Moz,done
210,"Redirects and Google Search – Types, Implementation, and Canonicalization",Moz,done
1616,The Moz Blog Expert SEO Inbound Marketing Advice   Moz,Moz,done
211,rel Attributes – Qualifying Outbound Links for Google,Moz,done
268,Perplexity Content Structure for Citation Optimisation,Perplexity,done
269,Perplexity How It Works and Citation Model,Perplexity,done
270,Perplexity Technical Setup and robots txt Configuration,Perplexity,done
1698,Customer Acquisition Maximizing your Funnel   For Entrepreneurs Example 5 Getting a meeting with a D,Personal Blog,processing
838,How to build a growth team lessons from Uber Hubspot and others 50 slides at andrewchen 10,Personal Blog,done
862,Top 5 Pieces of Advice for First Time Founders Or Anyone Starting Up Really,Personal Blog,pending
1450,About   Schema org Community Group and Steering Group,Schema.org,done
1350,About   Schema org Community Group and Steering Group,Schema.org,done
1451,About   Schema org People,Schema.org,done
1351,About   Schema org People,Schema.org,done
275,Action,Schema.org,done
277,AggregateOffer,Schema.org,done
276,AggregateRating,Schema.org,done
278,Article,Schema.org,done
279,BlogPosting,Schema.org,done
280,Book,Schema.org,done
107,Breadcrumb Structured Data – BreadcrumbList for Site Navigation,Schema.org,done
281,BreadcrumbList,Schema.org,done
282,Course,Schema.org,done
283,CreativeWork,Schema.org,done
1377,Data model   Schema org,Schema.org,done
1477,Data model   Schema org,Schema.org,done
1374,Data model   Schema org Background notes,Schema.org,done
1474,Data model   Schema org Background notes,Schema.org,done
1375,Data model   Schema org Conformance,Schema.org,done
1475,Data model   Schema org Conformance,Schema.org,done
1476,Data model   Schema org Mapping to RDFa Lite,Schema.org,done
1376,Data model   Schema org Mapping to RDFa Lite,Schema.org,done
284,Dataset,Schema.org,done
1478,Developers   Schema org,Schema.org,done
1378,Developers   Schema org,Schema.org,done
125,Discussion Forum Structured Data – DiscussionForumPosting,Schema.org,done
131,Discussion Forum Structured Data – DiscussionForumPosting,Schema.org,done
139,Employer Aggregate Rating Structured Data – EmployerAggregateRating,Schema.org,done
285,EntryPoint,Schema.org,done
286,Event,Schema.org,done
1384,Extending Schemas   Schema org,Schema.org,done
1484,Extending Schemas   Schema org,Schema.org,done
1386,FAQ   schema org,Schema.org,done
1488,FAQ   schema org,Schema.org,done
1385,FAQ   schema org 2,Schema.org,done
1485,FAQ   schema org 2,Schema.org,done
1389,FAQ   schema org 3,Schema.org,done
1486,FAQ   schema org 3,Schema.org,done
288,FAQPage,Schema.org,done
1412,Getting Started   schema org,Schema.org,done
1512,Getting Started   schema org,Schema.org,done
1507,Getting Started   schema org 1 How to mark up your content using microdata,Schema.org,done
1407,Getting Started   schema org 1 How to mark up your content using microdata,Schema.org,done
1508,Getting Started   schema org 2 Using the schema org vocabulary,Schema.org,done
1408,Getting Started   schema org 2 Using the schema org vocabulary,Schema.org,done
1509,Getting Started   schema org 3a Dates times and durations use the time tag with datetime,Schema.org,done
1409,Getting Started   schema org 3a Dates times and durations use the time tag with datetime,Schema.org,done
1510,Getting Started   schema org 3b Enumerations and canonical references use link with href,Schema.org,done
1410,Getting Started   schema org 3b Enumerations and canonical references use link with href,Schema.org,done
1411,Getting Started   schema org 3c Missing implicit information use the meta tag with content,Schema.org,done
1511,Getting Started   schema org 3c Missing implicit information use the meta tag with content,Schema.org,done
1413,Hotels   Schema org Basic Pattern,Schema.org,done
1513,Hotels   Schema org Basic Pattern,Schema.org,done
1414,Hotels   Schema org Fees for Optional Services,Schema.org,done
1514,Hotels   Schema org Fees for Optional Services,Schema.org,done
1415,Hotels   Schema org Geo Position,Schema.org,done
1515,Hotels   Schema org Geo Position,Schema.org,done
1416,Hotels   Schema org Information about Rooms,Schema.org,done
1516,Hotels   Schema org Information about Rooms,Schema.org,done
1517,Hotels   Schema org Minimal Example,Schema.org,done
1417,Hotels   Schema org Minimal Example,Schema.org,done
1418,Hotels   Schema org Overview,Schema.org,done
1518,Hotels   Schema org Overview,Schema.org,done
1419,Hotels   Schema org Star Rating,Schema.org,done
1519,Hotels   Schema org Star Rating,Schema.org,done
1420,Hotels   Schema org Validity of an Offer,Schema.org,done
1520,Hotels   Schema org Validity of an Offer,Schema.org,done
1538,How we work   schema org Early Access Fixes and Pending Releases,Schema.org,done
1536,How we work   schema org Extensibility Mechanisms,Schema.org,done
1539,How we work   schema org Overview,Schema.org,done
1537,How we work   schema org Schema definitions,Schema.org,done
1541,How we work   schema org Schema structure,Schema.org,done
1542,How we work   schema org Versioning and change control,Schema.org,done
1543,How we work   schema org Workflow FAQ Part 1,Schema.org,done
1544,How we work   schema org Workflow FAQ Part 2,Schema.org,done
1545,How we work   schema org Workflow FAQ Part 3,Schema.org,done
1546,How we work   schema org Workflow FAQ Part 4,Schema.org,done
1547,How we work   schema org Workflow FAQ Part 5,Schema.org,done
287,HowTo,Schema.org,done
289,ImageObject,Schema.org,done
292,Intangible,Schema.org,done
290,ItemList,Schema.org,done
176,Job Posting Structured Data – JobPosting for Job Search Experience,Schema.org,done
291,JobPosting,Schema.org,done
293,ListItem,Schema.org,done
294,LocalBusiness,Schema.org,done
182,Loyalty Program Structured Data – MemberProgram for Membership Benefits,Schema.org,done
189,Merchant Return Policy Structured Data – MerchantReturnPolicy,Schema.org,done
190,Merchant Shipping Policy Structured Data – ShippingService,Schema.org,done
295,Movie,Schema.org,done
296,MusicRecording,Schema.org,done
297,NewsArticle,Schema.org,done
298,Offer,Schema.org,done
299,Organization,Schema.org,done
300,Person,Schema.org,done
301,Place,Schema.org,done
302,PriceSpecification,Schema.org,done
303,Product,Schema.org,done
305,Product,Schema.org,done
206,Profile Page Structured Data – ProfilePage for Creator Profiles,Schema.org,done
306,ProfilePage,Schema.org,done
304,ProfilePage,Schema.org,done
208,Q&A Page Structured Data – QAPage for Questions and Answers,Schema.org,done
307,QAPage,Schema.org,done
308,Rating,Schema.org,done
309,Recipe,Schema.org,done
310,Review,Schema.org,done
273,Schema QAPage AEO Application,Schema.org,done
1592,Schemas   Schema org,Schema.org,done
311,SearchAction,Schema.org,done
313,SoftwareApplication,Schema.org,done
312,SpeakableSpecification,Schema.org,done
314,SpecialAnnouncement,Schema.org,done
315,TechArticle,Schema.org,done
316,Thing,Schema.org,done
252,Vacation Rental Structured Data – VacationRental Listings,Schema.org,done
246,Vacation Rental Structured Data – VacationRental Listings,Schema.org,done
254,"Video Structured Data – VideoObject, Clip, and BroadcastEvent",Schema.org,done
249,"Video Structured Data – VideoObject, Clip, and BroadcastEvent",Schema.org,done
317,VideoObject,Schema.org,done
318,WebPage,Schema.org,done
319,WebSite,Schema.org,done
1349,A Step By Step Guide For Growing AI Engine Engagement,Search Engine Journal,done
1449,A Step By Step Guide For Growing AI Engine Engagement,Search Engine Journal,done
1344,A Step By Step Guide For Growing AI Engine Engagement An Easier Way To Monitor AI Visits SEO Bulk Ad,Search Engine Journal,done
1444,A Step By Step Guide For Growing AI Engine Engagement An Easier Way To Monitor AI Visits SEO Bulk Ad,Search Engine Journal,done
1345,A Step By Step Guide For Growing AI Engine Engagement How To Track AI Crawler Activity Find Use Log,Search Engine Journal,done
1445,A Step By Step Guide For Growing AI Engine Engagement How To Track AI Crawler Activity Find Use Log,Search Engine Journal,done
1346,A Step By Step Guide For Growing AI Engine Engagement Take A Systematic Approach To AI Engine Optimi,Search Engine Journal,done
1446,A Step By Step Guide For Growing AI Engine Engagement Take A Systematic Approach To AI Engine Optimi,Search Engine Journal,done
1347,A Step By Step Guide For Growing AI Engine Engagement Using AI Crawler Data To Improve Content Strat,Search Engine Journal,done
1447,A Step By Step Guide For Growing AI Engine Engagement Using AI Crawler Data To Improve Content Strat,Search Engine Journal,done
1448,A Step By Step Guide For Growing AI Engine Engagement What Are AI Crawlers How To Use Them To Your A,Search Engine Journal,done
1348,A Step By Step Guide For Growing AI Engine Engagement What Are AI Crawlers How To Use Them To Your A,Search Engine Journal,done
258,Where Ecommerce Content Can Appear on Google,Search Engine Journal,done
116,Core Updates – What They Are and How to Respond,Search Engine Land,done
1394,Generative engine optimization GEO How to win AI mentions 1 SEO fundamentals are the foundation,Search Engine Land,done
1494,Generative engine optimization GEO How to win AI mentions 1 SEO fundamentals are the foundation,Search Engine Land,done
1395,Generative engine optimization GEO How to win AI mentions 2 Entity clarity shapes AI understanding,Search Engine Land,done
1495,Generative engine optimization GEO How to win AI mentions 2 Entity clarity shapes AI understanding,Search Engine Land,done
1496,Generative engine optimization GEO How to win AI mentions 3 Content must be easy to extract and reus,Search Engine Land,done
1396,Generative engine optimization GEO How to win AI mentions 3 Content must be easy to extract and reus,Search Engine Land,done
1397,Generative engine optimization GEO How to win AI mentions 4 AI visibility extends beyond your websit,Search Engine Land,done
1497,Generative engine optimization GEO How to win AI mentions 4 AI visibility extends beyond your websit,Search Engine Land,done
1398,Generative engine optimization GEO How to win AI mentions 5 Visibility Is measured differently in AI,Search Engine Land,done
1498,Generative engine optimization GEO How to win AI mentions 5 Visibility Is measured differently in AI,Search Engine Land,done
1499,Generative engine optimization GEO How to win AI mentions A comprehensive guide to generative engine,Search Engine Land,done
1400,Generative engine optimization GEO How to win AI mentions A comprehensive guide to generative engine,Search Engine Land,done
1399,Generative engine optimization GEO How to win AI mentions Frequently asked questions,Search Engine Land,done
1500,Generative engine optimization GEO How to win AI mentions Frequently asked questions,Search Engine Land,done
1401,Generative engine optimization GEO How to win AI mentions How GEO differs from traditional SEO,Search Engine Land,done
1501,Generative engine optimization GEO How to win AI mentions How GEO differs from traditional SEO,Search Engine Land,done
533,Mastering generative engine optimization in 2026 Full guide How to get your brand cited recommended,Search Engine Land,done
535,Mastering generative engine optimization in 2026 Full guide Phase 2 Optimize your content for AI eng,Search Engine Land,done
534,Mastering generative engine optimization in 2026 Full guide Phase 3 Measure your AI search performan,Search Engine Land,done
536,Mastering generative engine optimization in 2026 Full guide Phase 4 Iterate and scale,Search Engine Land,done
1594,SEO in 2026 Higher standards AI influence and a web still catching up Charting the impacts of AI,Search Engine Land,done
1595,SEO in 2026 Higher standards AI influence and a web still catching up Deprecated but not forgotten,Search Engine Land,done
1596,SEO in 2026 Higher standards AI influence and a web still catching up FAQ growth,Search Engine Land,done
1597,SEO in 2026 Higher standards AI influence and a web still catching up LLMs txt,Search Engine Land,done
1598,SEO in 2026 Higher standards AI influence and a web still catching up More work is needed,Search Engine Land,done
1599,SEO in 2026 Higher standards AI influence and a web still catching up Not a rewrite A new layer on t,Search Engine Land,done
