id,title,slug,source_org,source_url,status
1358,"AI s Impact on SEO 13 Things That Changed 4 Things That Stayed The Same","ai_s_impact_on_seo_13_things_that_changed_4_things_that_stayed_the_same","Ahrefs","https://ahrefs.com/blog/ai-impact-on-seo","done"
1458,"AI s Impact on SEO 13 Things That Changed 4 Things That Stayed The Same","ai_s_impact_on_seo_13_things_that_changed_4_things_that_stayed_the_same","Ahrefs","https://ahrefs.com/blog/ai-impact-on-seo","done"
1452,"AI s Impact on SEO 13 Things That Changed 4 Things That Stayed The Same 2","ai_s_impact_on_seo_13_things_that_changed_4_things_that_stayed_the_same_2","Ahrefs","https://ahrefs.com/blog/ai-impact-on-seo","done"
1352,"AI s Impact on SEO 13 Things That Changed 4 Things That Stayed The Same 2","ai_s_impact_on_seo_13_things_that_changed_4_things_that_stayed_the_same_2","Ahrefs","https://ahrefs.com/blog/ai-impact-on-seo","done"
1353,"AI s Impact on SEO 13 Things That Changed 4 Things That Stayed The Same 3","ai_s_impact_on_seo_13_things_that_changed_4_things_that_stayed_the_same_3","Ahrefs","https://ahrefs.com/blog/ai-impact-on-seo","done"
1453,"AI s Impact on SEO 13 Things That Changed 4 Things That Stayed The Same 3","ai_s_impact_on_seo_13_things_that_changed_4_things_that_stayed_the_same_3","Ahrefs","https://ahrefs.com/blog/ai-impact-on-seo","done"
1354,"AI s Impact on SEO 13 Things That Changed 4 Things That Stayed The Same 4","ai_s_impact_on_seo_13_things_that_changed_4_things_that_stayed_the_same_4","Ahrefs","https://ahrefs.com/blog/ai-impact-on-seo","done"
1454,"AI s Impact on SEO 13 Things That Changed 4 Things That Stayed The Same 4","ai_s_impact_on_seo_13_things_that_changed_4_things_that_stayed_the_same_4","Ahrefs","https://ahrefs.com/blog/ai-impact-on-seo","done"
1355,"AI s Impact on SEO 13 Things That Changed 4 Things That Stayed The Same 5","ai_s_impact_on_seo_13_things_that_changed_4_things_that_stayed_the_same_5","Ahrefs","https://ahrefs.com/blog/ai-impact-on-seo","done"
1455,"AI s Impact on SEO 13 Things That Changed 4 Things That Stayed The Same 5","ai_s_impact_on_seo_13_things_that_changed_4_things_that_stayed_the_same_5","Ahrefs","https://ahrefs.com/blog/ai-impact-on-seo","done"
1356,"AI s Impact on SEO 13 Things That Changed 4 Things That Stayed The Same 6","ai_s_impact_on_seo_13_things_that_changed_4_things_that_stayed_the_same_6","Ahrefs","https://ahrefs.com/blog/ai-impact-on-seo","done"
1456,"AI s Impact on SEO 13 Things That Changed 4 Things That Stayed The Same 6","ai_s_impact_on_seo_13_things_that_changed_4_things_that_stayed_the_same_6","Ahrefs","https://ahrefs.com/blog/ai-impact-on-seo","done"
1357,"AI s Impact on SEO 13 Things That Changed 4 Things That Stayed The Same 7","ai_s_impact_on_seo_13_things_that_changed_4_things_that_stayed_the_same_7","Ahrefs","https://ahrefs.com/blog/ai-impact-on-seo","done"
1457,"AI s Impact on SEO 13 Things That Changed 4 Things That Stayed The Same 7","ai_s_impact_on_seo_13_things_that_changed_4_things_that_stayed_the_same_7","Ahrefs","https://ahrefs.com/blog/ai-impact-on-seo","done"
1406,"GEO LLMO AEO It s All Just SEO","geo_llmo_aeo_it_s_all_just_seo","Ahrefs","https://ahrefs.com/blog/geo-is-just-seo","done"
1506,"GEO LLMO AEO It s All Just SEO","geo_llmo_aeo_it_s_all_just_seo","Ahrefs","https://ahrefs.com/blog/geo-is-just-seo","done"
1503,"GEO LLMO AEO It s All Just SEO 2","geo_llmo_aeo_it_s_all_just_seo_2","Ahrefs","https://ahrefs.com/blog/geo-is-just-seo","done"
1403,"GEO LLMO AEO It s All Just SEO 2","geo_llmo_aeo_it_s_all_just_seo_2","Ahrefs","https://ahrefs.com/blog/geo-is-just-seo","done"
1504,"GEO LLMO AEO It s All Just SEO 3","geo_llmo_aeo_it_s_all_just_seo_3","Ahrefs","https://ahrefs.com/blog/geo-is-just-seo","done"
1404,"GEO LLMO AEO It s All Just SEO 3","geo_llmo_aeo_it_s_all_just_seo_3","Ahrefs","https://ahrefs.com/blog/geo-is-just-seo","done"
1505,"GEO LLMO AEO It s All Just SEO 4","geo_llmo_aeo_it_s_all_just_seo_4","Ahrefs","https://ahrefs.com/blog/geo-is-just-seo","done"
1405,"GEO LLMO AEO It s All Just SEO 4","geo_llmo_aeo_it_s_all_just_seo_4","Ahrefs","https://ahrefs.com/blog/geo-is-just-seo","done"
1402,"Generative Engine Optimization Growth Strategies and Metrics For the AI Era","generative_engine_optimization_growth_strategies_and_metrics_for_the_ai_era","Ahrefs","https://ahrefs.com/blog/geo-generative-engine-optimization","done"
1502,"Generative Engine Optimization Growth Strategies and Metrics For the AI Era","generative_engine_optimization_growth_strategies_and_metrics_for_the_ai_era","Ahrefs","https://ahrefs.com/blog/geo-generative-engine-optimization","done"
523,"How to Rank in AI Overviews What Actually Works Based on Data Not Speculation None Part 1","how_to_rank_in_ai_overviews_what_actually_works_based_on_data_not_speculation_none_part_1","Ahrefs","https://ahrefs.com/blog/how-to-rank-in-ai-overviews","done"
524,"How to Rank in AI Overviews What Actually Works Based on Data Not Speculation None Part 2","how_to_rank_in_ai_overviews_what_actually_works_based_on_data_not_speculation_none_part_2","Ahrefs","https://ahrefs.com/blog/how-to-rank-in-ai-overviews","done"
525,"How to Rank in AI Overviews What Actually Works Based on Data Not Speculation None Part 3","how_to_rank_in_ai_overviews_what_actually_works_based_on_data_not_speculation_none_part_3","Ahrefs","https://ahrefs.com/blog/how-to-rank-in-ai-overviews","done"
526,"How to Rank in AI Overviews What Actually Works Based on Data Not Speculation None Part 4","how_to_rank_in_ai_overviews_what_actually_works_based_on_data_not_speculation_none_part_4","Ahrefs","https://ahrefs.com/blog/how-to-rank-in-ai-overviews","done"
529,"How to Rank in AI Overviews What Actually Works Based on Data Not Speculation Partner with YouTube c","how_to_rank_in_ai_overviews_what_actually_works_based_on_data_not_speculation_partner_with_youtube_c","Ahrefs","https://ahrefs.com/blog/how-to-rank-in-ai-overviews","done"
528,"How to Rank in AI Overviews What Actually Works Based on Data Not Speculation Partner with YouTube c 2","how_to_rank_in_ai_overviews_what_actually_works_based_on_data_not_speculation_partner_with_youtube_c_2","Ahrefs","https://ahrefs.com/blog/how-to-rank-in-ai-overviews","done"
532,"Insights From 55 8M AI Overviews Across 590M Searches","insights_from_55_8m_ai_overviews_across_590m_searches","Ahrefs","https://ahrefs.com/blog/insights-from-56-million-ai-overviews","done"
531,"Insights From 55 8M AI Overviews Across 590M Searches 2","insights_from_55_8m_ai_overviews_across_590m_searches_2","Ahrefs","https://ahrefs.com/blog/insights-from-56-million-ai-overviews","done"
527,"Insights From 55 8M AI Overviews Across 590M Searches 3","insights_from_55_8m_ai_overviews_across_590m_searches_3","Ahrefs","https://ahrefs.com/blog/insights-from-56-million-ai-overviews","done"
530,"Insights From 55 8M AI Overviews Across 590M Searches 4","insights_from_55_8m_ai_overviews_across_590m_searches_4","Ahrefs","https://ahrefs.com/blog/insights-from-56-million-ai-overviews","done"
1553,"Is AI Content Bad for SEO No and It Never Will Be 7 Reasons","is_ai_content_bad_for_seo_no_and_it_never_will_be_7_reasons","Ahrefs","https://ahrefs.com/blog/ai-content-is-not-bad-for-seo","done"
1551,"Is AI Content Bad for SEO No and It Never Will Be 7 Reasons 2","is_ai_content_bad_for_seo_no_and_it_never_will_be_7_reasons_2","Ahrefs","https://ahrefs.com/blog/ai-content-is-not-bad-for-seo","done"
1552,"Is AI Content Bad for SEO No and It Never Will Be 7 Reasons 3","is_ai_content_bad_for_seo_no_and_it_never_will_be_7_reasons_3","Ahrefs","https://ahrefs.com/blog/ai-content-is-not-bad-for-seo","done"
539,"Update 38 of AI Overview Citations Pull From The Top 10","update_38_of_ai_overview_citations_pull_from_the_top_10","Ahrefs","https://ahrefs.com/blog/ai-overview-citations-top-10","done"
537,"Update 38 of AI Overview Citations Pull From The Top 10 2","update_38_of_ai_overview_citations_pull_from_the_top_10_2","Ahrefs","https://ahrefs.com/blog/ai-overview-citations-top-10","done"
538,"Update 38 of AI Overview Citations Pull From The Top 10 3","update_38_of_ai_overview_citations_pull_from_the_top_10_3","Ahrefs","https://ahrefs.com/blog/ai-overview-citations-top-10","done"
540,"Update AI Overviews Reduce Clicks by 58","update_ai_overviews_reduce_clicks_by_58","Ahrefs","https://ahrefs.com/blog/ai-overviews-reduce-clicks-update","done"
262,"Bing IndexNow Real Time Indexing for AI Visibility","bing_indexnow_real_time_indexing_for_ai_visibility","Bing","","done"
260,"Bing Webmaster Guidelines AI and Copilot Grounding","bing_webmaster_guidelines_ai_and_copilot_grounding","Bing","","done"
97,"AB Testing and Multivariate Testing Best Practices for Google Search","ab_testing_and_multivariate_testing_best_practices_for_google_search","Google","https://developers.google.com/search/docs","done"
337,"AI Features and Your Website Controlling your content in AI features in Search","ai_features_and_your_website_controlling_your_content_in_ai_features_in_search","Google","https://developers.google.com/search/docs/appearance/ai-features","done"
338,"AI Features and Your Website How AI features work in Search","ai_features_and_your_website_how_ai_features_work_in_search","Google","https://developers.google.com/search/docs/appearance/ai-features","done"
339,"AI Features and Your Website How to appear in AI features","ai_features_and_your_website_how_to_appear_in_ai_features","Google","https://developers.google.com/search/docs/appearance/ai-features","done"
99,"AI Features and Your Website – AI Overviews and AI Mode","ai_features_and_your_website_ai_overviews_and_ai_mode","Google","https://developers.google.com/search/docs","done"
100,""AMP on Google Search – Guidelines, How It Works, Enhancing, Validating, and Removing"","amp_on_google_search_guidelines_how_it_works_enhancing_validating_and_removing","Google","https://developers.google.com/search/docs","done"
98,"Ad Networks and Translation Related Google Search Features","ad_networks_and_translation_related_google_search_features","Google","https://developers.google.com/search/docs","done"
102,""Article Structured Data – News, Blog, and Sports Articles"","article_structured_data_news_blog_and_sports_articles","Google","https://developers.google.com/search/docs","done"
105,""Article Structured Data – News, Blog, and Sports Articles"","article_structured_data_news_blog_and_sports_articles","Google","https://developers.google.com/search/docs","error"
101,"Ask Google to Recrawl Your URLs","ask_google_to_recrawl_your_urls","Google","https://developers.google.com/search/docs","done"
103,"Ask Google to Recrawl Your URLs","ask_google_to_recrawl_your_urls","Google","https://developers.google.com/search/docs","error"
104,"Block Search Indexing with noindex","block_search_indexing_with_noindex","Google","https://developers.google.com/search/docs","done"
106,"Book Actions Structured Data – Enabling Buy and Borrow Actions","book_actions_structured_data_enabling_buy_and_borrow_actions","Google","https://developers.google.com/search/docs","done"
108,"Build and Submit a Sitemap to Google","build_and_submit_a_sitemap_to_google","Google","https://developers.google.com/search/docs","done"
109,"Business Details in Google Search and Maps","business_details_in_google_search_and_maps","Google","https://developers.google.com/search/docs","done"
110,"Byline Dates – Adding Publication Dates to Search Results","byline_dates_adding_publication_dates_to_search_results","Google","https://developers.google.com/search/docs","done"
111,"Carousel Structured Data – Host Carousels with ItemList","carousel_structured_data_host_carousels_with_itemlist","Google","https://developers.google.com/search/docs","done"
112,"Changing Your Web Hosting Without Changing URLs","changing_your_web_hosting_without_changing_urls","Google","https://developers.google.com/search/docs","done"
114,"Combining Sitemap Extensions – Using Multiple Extensions in One File","combining_sitemap_extensions_using_multiple_extensions_in_one_file","Google","https://developers.google.com/search/docs","done"
115,"Controlling What Content Google Can Find and Index","controlling_what_content_google_can_find_and_index","Google","https://developers.google.com/search/docs","done"
117,""Core Web Vitals – LCP, INP, and CLS Explained"","core_web_vitals_lcp_inp_and_cls_explained","Google","https://developers.google.com/search/docs","done"
118,"Course List Structured Data – Course Discoverability on Google","course_list_structured_data_course_discoverability_on_google","Google","https://developers.google.com/search/docs","done"
119,"Crawling and Indexing – Overview","crawling_and_indexing_overview","Google","https://developers.google.com/search/docs","done"
120,"Creating Helpful People First Content","creating_helpful_people_first_content","Google","https://developers.google.com/search/docs","done"
121,"Debug Google Search Traffic Drops","debug_google_search_traffic_drops","Google","https://developers.google.com/search/docs","done"
128,"Debug Google Search Traffic Drops","debug_google_search_traffic_drops","Google","https://developers.google.com/search/docs","done"
129,"Debugging with Google Search Operators","debugging_with_google_search_operators","Google","https://developers.google.com/search/docs","done"
123,"Debugging with Google Search Operators","debugging_with_google_search_operators","Google","https://developers.google.com/search/docs","done"
132,"Developer's Guide to Search","developers_guide_to_search","Google","https://developers.google.com/search/docs","done"
124,"Developer's Guide to Search","developers_guide_to_search","Google","https://developers.google.com/search/docs","done"
126,"Do You Need an SEO","do_you_need_an_seo","Google","https://developers.google.com/search/docs","done"
133,"Do You Need an SEO","do_you_need_an_seo","Google","https://developers.google.com/search/docs","done"
127,"Dynamic Rendering as a Workaround for JavaScript Content","dynamic_rendering_as_a_workaround_for_javascript_content","Google","https://developers.google.com/search/docs","done"
134,"Dynamic Rendering as a Workaround for JavaScript Content","dynamic_rendering_as_a_workaround_for_javascript_content","Google","https://developers.google.com/search/docs","done"
137,"Ecommerce SEO – Overview and Guide Structure","ecommerce_seo_overview_and_guide_structure","Google","https://developers.google.com/search/docs","done"
135,"Ecommerce Site Structure – Helping Google Understand Navigation Hierarchy","ecommerce_site_structure_helping_google_understand_navigation_hierarchy","Google","https://developers.google.com/search/docs","done"
136,"Ecommerce URL Structure Design Best Practices","ecommerce_url_structure_design_best_practices","Google","https://developers.google.com/search/docs","done"
138,"Education Q&A Structured Data – Flashcard Pages","education_qa_structured_data_flashcard_pages","Google","https://developers.google.com/search/docs","done"
140,"Enriched Search Results – Interactive Rich Results with Structured Data","enriched_search_results_interactive_rich_results_with_structured_data","Google","https://developers.google.com/search/docs","done"
141,"Event Structured Data – Event Rich Results on Google","event_structured_data_event_rich_results_on_google","Google","https://developers.google.com/search/docs","done"
142,"FAQ Structured Data – FAQPage for Government and Health Sites","faq_structured_data_faqpage_for_government_and_health_sites","Google","https://developers.google.com/search/docs","done"
143,"Fact Check Structured Data – ClaimReview for Fact Checking Articles","fact_check_structured_data_claimreview_for_fact_checking_articles","Google","https://developers.google.com/search/docs","done"
144,"Favicons in Google Search – Guidelines and Requirements","favicons_in_google_search_guidelines_and_requirements","Google","https://developers.google.com/search/docs","done"
146,"File Types Indexable by Google","file_types_indexable_by_google","Google","https://developers.google.com/search/docs","done"
147,"Fix Canonicalization Issues","fix_canonicalization_issues","Google","https://developers.google.com/search/docs","done"
149,"Fix Lazy Loaded Content for Google Search","fix_lazy_loaded_content_for_google_search","Google","https://developers.google.com/search/docs","done"
148,"Fix Search Related JavaScript Problems","fix_search_related_javascript_problems","Google","https://developers.google.com/search/docs","done"
150,"Flexible Sampling – Paywalls and Limited Content Access","flexible_sampling_paywalls_and_limited_content_access","Google","https://developers.google.com/search/docs","done"
153,"Generate Structured Data with JavaScript","generate_structured_data_with_javascript","Google","https://developers.google.com/search/docs","done"
152,"Get Started with Google Search Console","get_started_with_google_search_console","Google","https://developers.google.com/search/docs","done"
151,"Get Started with Google Trends for SEO","get_started_with_google_trends_for_seo","Google","https://developers.google.com/search/docs","done"
155,"Get Your Website on Google","get_your_website_on_google","Google","https://developers.google.com/search/docs","done"
263,"Google AI Mode How It Works and Optimisation","google_ai_mode_how_it_works_and_optimisation","Google","https://developers.google.com/search/docs","done"
264,"Google AI Overviews Content Optimisation for Citation","google_ai_overviews_content_optimisation_for_citation","Google","https://developers.google.com/search/docs","done"
265,"Google AI Overviews Eligibility and Technical Requirements","google_ai_overviews_eligibility_and_technical_requirements","Google","https://developers.google.com/search/docs","done"
266,"Google AI Overviews Generative AI Content Policy","google_ai_overviews_generative_ai_content_policy","Google","https://developers.google.com/search/docs","done"
267,"Google AI Overviews Robots Meta Tag Controls","google_ai_overviews_robots_meta_tag_controls","Google","https://developers.google.com/search/docs","done"
156,"Google Discover – How Content Is Selected and Best Practices","google_discover_how_content_is_selected_and_best_practices","Google","https://developers.google.com/search/docs","done"
154,"Google Safe Browsing Repeat Offenders Policy","google_safe_browsing_repeat_offenders_policy","Google","https://developers.google.com/search/docs","done"
158,"Google Search Reviews System","google_search_reviews_system","Google","https://developers.google.com/search/docs","done"
157,"Googlebot – What It Is and How It Works","googlebot_what_it_is_and_how_it_works","Google","https://developers.google.com/search/docs","done"
159,"Guidance on Generative AI Content","guidance_on_generative_ai_content","Google","https://developers.google.com/search/docs","done"
160,"Guidelines for Sites with Explicit Content","guidelines_for_sites_with_explicit_content","Google","https://developers.google.com/search/docs","done"
165,""HTTP Status Codes, Network Errors, and DNS Errors"","http_status_codes_network_errors_and_dns_errors","Google","https://developers.google.com/search/docs","done"
161,"How Google Crawls Locale Adaptive Pages","how_google_crawls_locale_adaptive_pages","Google","https://developers.google.com/search/docs","done"
163,"How Google Search Works","how_google_search_works","Google","https://developers.google.com/search/docs","done"
162,"How Structured Data Works – Introduction to Rich Results","how_structured_data_works_introduction_to_rich_results","Google","https://developers.google.com/search/docs","done"
164,"How to Launch an Ecommerce Website on Google","how_to_launch_an_ecommerce_website_on_google","Google","https://developers.google.com/search/docs","done"
166,"Image License Metadata – Licensable Badge in Google Images","image_license_metadata_licensable_badge_in_google_images","Google","https://developers.google.com/search/docs","done"
167,"Image Removals – Removing Images from Google Search Results","image_removals_removing_images_from_google_search_results","Google","https://developers.google.com/search/docs","done"
168,"Image SEO Best Practices for Google Search","image_seo_best_practices_for_google_search","Google","https://developers.google.com/search/docs","done"
169,"Image Sitemaps – Helping Google Find Site Images","image_sitemaps_helping_google_find_site_images","Google","https://developers.google.com/search/docs","done"
170,"Improve SEO with a Search Console Bubble Chart in Looker Studio","improve_seo_with_a_search_console_bubble_chart_in_looker_studio","Google","https://developers.google.com/search/docs","done"
171,"International and Multilingual Sites – Overview","international_and_multilingual_sites_overview","Google","https://developers.google.com/search/docs","done"
172,"Interstitials and Dialogs – Avoiding Intrusive Page Overlays","interstitials_and_dialogs_avoiding_intrusive_page_overlays","Google","https://developers.google.com/search/docs","done"
174,"Introduction to robots.txt","introduction_to_robotstxt","Google","https://developers.google.com/search/docs","done"
173,"Introduction – Google Search Central Documentation","introduction_google_search_central_documentation","Google","https://developers.google.com/search/docs","done"
178,"Keep Redacted Information Out of Google Search","keep_redacted_information_out_of_google_search","Google","https://developers.google.com/search/docs","done"
181,"Local Business Structured Data – LocalBusiness for Knowledge Panels and Maps","local_business_structured_data_localbusiness_for_knowledge_panels_and_maps","Google","https://developers.google.com/search/docs","done"
184,"Maintaining Your Website's SEO","maintaining_your_websites_seo","Google","https://developers.google.com/search/docs","done"
183,"Malware and Unwanted Software – What They Are and Google's Guidelines","malware_and_unwanted_software_what_they_are_and_googles_guidelines","Google","https://developers.google.com/search/docs","done"
185,"Managing Crawling of Faceted Navigation URLs","managing_crawling_of_faceted_navigation_urls","Google","https://developers.google.com/search/docs","done"
186,"Managing Multi Regional and Multilingual Sites","managing_multi_regional_and_multilingual_sites","Google","https://developers.google.com/search/docs","done"
187,"Math Solver Structured Data – MathSolver for Educational Tools","math_solver_structured_data_mathsolver_for_educational_tools","Google","https://developers.google.com/search/docs","done"
188,"Merchant Listing Structured Data – Products for Sale","merchant_listing_structured_data_products_for_sale","Google","https://developers.google.com/search/docs","done"
193,"Meta Tags and HTML Attributes that Google Supports","meta_tags_and_html_attributes_that_google_supports","Google","https://developers.google.com/search/docs","done"
191,"Mobile First Indexing Best Practices","mobile_first_indexing_best_practices","Google","https://developers.google.com/search/docs","done"
192,"Move a Site with URL Changes – Migrations and Domain Changes","move_a_site_with_url_changes_migrations_and_domain_changes","Google","https://developers.google.com/search/docs","done"
194,"Movie Carousel Structured Data – Movie Rich Results on Mobile","movie_carousel_structured_data_movie_rich_results_on_mobile","Google","https://developers.google.com/search/docs","done"
195,"News Sitemaps – Submitting News Articles to Google","news_sitemaps_submitting_news_articles_to_google","Google","https://developers.google.com/search/docs","done"
196,"Organisation Structured Data – Helping Google Understand Your Business Entity","organisation_structured_data_helping_google_understand_your_business_entity","Google","https://developers.google.com/search/docs","done"
197,"Package Tracking – Early Adopters Program for Delivery Companies","package_tracking_early_adopters_program_for_delivery_companies","Google","https://developers.google.com/search/docs","done"
198,"Page Removals – How to Remove a Page from Google Search","page_removals_how_to_remove_a_page_from_google_search","Google","https://developers.google.com/search/docs","done"
199,"Pagination and Incremental Page Loading for Ecommerce","pagination_and_incremental_page_loading_for_ecommerce","Google","https://developers.google.com/search/docs","done"
200,"Preferred Sources – Helping Your Audience Follow Your Publication","preferred_sources_helping_your_audience_follow_your_publication","Google","https://developers.google.com/search/docs","done"
202,"Prevent User Generated Spam on Your Site","prevent_user_generated_spam_on_your_site","Google","https://developers.google.com/search/docs","done"
201,"Prevent a Malware Infection – Security Best Practices for Site Owners","prevent_a_malware_infection_security_best_practices_for_site_owners","Google","https://developers.google.com/search/docs","done"
203,"Preventing and Monitoring Abuse on Your Site – Overview","preventing_and_monitoring_abuse_on_your_site_overview","Google","https://developers.google.com/search/docs","done"
204,"Product Snippet Structured Data – Non Merchant Product Pages","product_snippet_structured_data_non_merchant_product_pages","Google","https://developers.google.com/search/docs","done"
205,"Product Variants Structured Data – ProductGroup for Size and Color Variants","product_variants_structured_data_productgroup_for_size_and_color_variants","Google","https://developers.google.com/search/docs","done"
209,"Ranking and Search Appearance – Overview","ranking_and_search_appearance_overview","Google","https://developers.google.com/search/docs","done"
207,"Recipe Structured Data – Rich Results for Recipes","recipe_structured_data_rich_results_for_recipes","Google","https://developers.google.com/search/docs","done"
212,"Review Snippet Structured Data – Stars and Ratings in Search Results","review_snippet_structured_data_stars_and_ratings_in_search_results","Google","https://developers.google.com/search/docs","done"
